### ISSUE TITLE
TCP SYN ACK Flood 

### ISSUE THREAD

**Issue by john-d13** [semigodking/redsocks#124]
Is there any mechanism to protect from SYN/ACK Flooding when configured for upstream HTTP Proxy ?

I see thousands of stale connections in "TIME_WAIT" status since the SSL Handshake is broken.  More-so its generating thousands of reconnection attempts. 

Tried tuning these params to no avail
       //tcp_keepalive_time = 600;
        //tcp_keepalive_probes = 20;
        //tcp_keepalive_intvl = 3;

> 16:22:04.969431 IP 76.8.60.128.43036 > 63.115.158.246.11961: Flags [F.], seq 127, ack 40, win 29200, length 0
> 16:22:04.969446 IP 76.8.60.128.43034 > 63.115.158.246.11961: Flags [P.], seq 80:122, ack 40, win 29200, length 42
> 16:22:04.969462 IP 76.8.60.128.43034 > 63.115.158.246.11961: Flags [F.], seq 122, ack 40, win 29200, length 0
> 16:22:04.970318 ARP, Request who-has 38.123.137.234 tell 38.123.137.1, length 46
> 16:22:04.977299 IP 63.115.158.246.11961 > 76.8.60.128.43042: Flags [S.], seq 3704204860, ack 514841450, win 14600, options [mss 1460,nop,nop,sackOK], length 0
> 16:22:04.977312 IP 76.8.60.128.43042 > 63.115.158.246.11961: Flags [.], ack 1, win 29200, length 0
> 16:22:04.977561 IP 63.115.158.246.11961 > 76.8.60.128.43044: Flags [S.], seq 3151610216, ack 3209407811, win 14600, options [mss 1460,nop,nop,sackOK], length 0
> 16:22:04.977571 IP 76.8.60.128.43044 > 63.115.158.246.11961: Flags [.], ack 1, win 29200, length 0
> 16:22:04.977583 IP 63.115.158.246.11961 > 76.8.60.128.43040: Flags [.], ack 80, win 14600, length 0
> 16:22:04.977673 IP 63.115.158.246.44767 > 76.8.60.128.10001: Flags [.], ack 2, win 14600, length 0
> 16:22:04.977678 IP 63.115.158.246.44228 > 76.8.60.128.10001: Flags [.], ack 2, win 14600, length 0
> 16:22:04.977705 IP 63.115.158.246.11961 > 76.8.60.128.43038: Flags [.], ack 80, win 14600, length 0
> 16:22:04.978590 IP 63.115.158.246.42611 > 76.8.60.128.10001: Flags [S], seq 3854704811, win 14600, options [mss 1460,nop,nop,sackOK], length 0
> 16:22:04.978605 IP 76.8.60.128.10001 > 63.115.158.246.42611: Flags [S.], seq 2540426578, ack 3854704812, win 29200, options [mss 1460,nop,nop,sackOK], length 0
> 16:22:04.978687 IP 63.115.158.246.60277 > 76.8.60.128.10001: Flags [P.], seq 1:48, ack 1, win 14600, length 47
> 16:22:04.978695 IP 76.8.60.128.10001 > 63.115.158.246.60277: Flags [.], ack 48, win 29200, length 0
> 16:22:04.979118 IP 63.115.158.246.60277 > 76.8.60.128.10001: Flags [F.], seq 48, ack 1, win 14600, length 0
> 16:22:04.979129 IP 63.115.158.246.11961 > 76.8.60.128.43036: Flags [F.], seq 40, ack 128, win 14600, length 0
> 16:22:04.979136 IP 76.8.60.128.43036 > 63.115.158.246.11961: Flags [.], ack 41, win 29200, length 0
> 16:22:04.979314 IP 63.115.158.246.35568 > 76.8.60.128.10001: Flags [S], seq 1746796581, win 14600, options [mss 1460,nop,nop,sackOK], length 0
> 16:22:04.979327 IP 76.8.60.128.10001 > 63.115.158.246.35568: Flags [S.], seq 4116937520, ack 1746796582, win 29200, options [mss 1460,nop,nop,sackOK], length 0
> 16:22:04.979411 IP 63.115.158.246.59005 > 76.8.60.128.10001: Flags [P.], seq 1:43, ack 1, win 14600, length 42
> 16:22:04.979419 IP 76.8.60.128.10001 > 63.115.158.246.59005: Flags [.], ack 43, win 29200, length 0
> 16:22:04.979599 IP 63.115.158.246.59005 > 76.8.60.128.10001: Flags [F.], seq 43, ack 1, win 14600, length 0
> 16:22:04.979689 IP 63.115.158.246.11961 > 76.8.60.128.43034: Flags [F.], seq 40, ack 123, win 14600, length 0
> 16:22:04.979698 IP 76.8.60.128.43034 > 63.115.158.246.11961: Flags [.], ack 41, win 29200, length 0

**Comment by semigodking** [comment]
TIME_WAIT has nothing to do with SYNC/ACK, it is part of normal TCP
connection shutdown procedure. If it is really a problem for you, you may
need to make code change to force shutdown redsocks server side connections
with TCP RST socket option SO_LINGER.

**Comment by john-d13** [comment]
I did some more digging.   The connections flooded with TCP SYN/ACK from the source server to destination proxy.  Just wondering if this is normal to build sessions to secure authentication via http.   I can share the capture with you privately (http creds are in clear text).

Source Server: 76.8.60.168

redsocks {
    local_ip = 0.0.0.0;
    local_port = 10001;
    ip =  63.115.158.247;
    port = 11961;
    type = http-connect;
    login = xxx;
    password = xxx;
}

Sequence

76.8.60.168 - > 63.115.158.247:11961 -  SYN Seq 0
63.115.158.247 -> 76.8.60.168 - SYN ACK Seq 0
76.8.60.168 - > 63.115.158.247:11961 - ACK Seq 1
76.8.60.168 - > 63.115.158.247:11961 - HTTP CONNECT Seq 1 next Seq 80 Connection Established
63.115.158.247 -> 76.8.60.168 - ACK Seq 1 ACK number 80
76.8.60.168 - > 63.115.158.247 - PSH ACK
76.8.60.168 - > 63.115.158.247 - FIN ACK
63.115.158.247 -> 76.8.60.168 - FIN ACK
76.8.60.168 - > 63.115.158.247 - ACK

**Comment by semigodking** [comment]
hi @john-d13 , the sequence show above shows everything works as expected.  I would strongly suggest you read this article [TIME_WAIT and its design implications for protocols and scalable client server systems](http://www.serverframework.com/asynchronousevents/2011/01/time-wait-and-its-design-implications-for-protocols-and-scalable-servers.html).

**Comment by john-d13** [comment]
Is there an email I can reach you at?  I'd like to go over some suggestions please.

**Comment by semigodking** [comment]
yes.the email address is at foot of readme

john-d13 <notifications@github.com> 于 2019年8月1日周四 04:51写道：
